{
  "$schema": "https://json-schema.org/draft/2020-12/schema",
  "title": "Brand AI-Readiness Audit Report",
  "type": "object",
  "required": [
    "site",
    "audited_at",
    "summary",
    "findings"
  ],
  "properties": {
    "site": {
      "type": "string"
    },
    "audited_at": {
      "type": "string",
      "format": "date-time"
    },
    "summary": {
      "type": "object",
      "required": [
        "total_findings",
        "critical",
        "high",
        "medium"
      ],
      "properties": {
        "total_findings": {
          "type": "integer",
          "description": "Equals len(findings[]); critical+high+medium+low+info add up to it"
        },
        "critical": {
          "type": "integer",
          "description": "findings of this severity, any status"
        },
        "high": {
          "type": "integer"
        },
        "medium": {
          "type": "integer"
        },
        "low": {
          "type": "integer"
        },
        "info": {
          "type": "integer"
        },
        "active_by_severity": {
          "type": "object",
          "description": "the same counts over active findings only (latent and confirm_intent excluded)",
          "required": [
            "critical",
            "high",
            "medium",
            "low"
          ],
          "properties": {
            "critical": {
              "type": "integer"
            },
            "high": {
              "type": "integer"
            },
            "medium": {
              "type": "integer"
            },
            "low": {
              "type": "integer"
            }
          }
        },
        "latent_findings": {
          "type": "integer",
          "description": "real findings currently unobservable behind an access blocker"
        },
        "by_hurts": {
          "type": "object",
          "description": "active findings counted by what they hurt",
          "properties": {
            "ai_discoverability": {
              "type": "integer"
            },
            "user_retention": {
              "type": "integer"
            },
            "both": {
              "type": "integer"
            }
          }
        },
        "run_status": {
          "enum": [
            "complete",
            "partial",
            "blocked",
            "failed"
          ]
        },
        "headline": {
          "type": "string"
        },
        "active_findings": {
          "type": "integer",
          "description": "findings that are live defects right now"
        },
        "confirm_intent_findings": {
          "type": "integer",
          "description": "configuration that looks deliberate; reported for confirmation, capped at low"
        }
      }
    },
    "findings": {
      "type": "array",
      "items": {
        "type": "object",
        "required": [
          "id",
          "title",
          "severity",
          "evidence",
          "suggested_action"
        ],
        "properties": {
          "id": {
            "type": "string",
            "pattern": "^F-[0-9]{3}$"
          },
          "title": {
            "type": "string"
          },
          "severity": {
            "enum": [
              "critical",
              "high",
              "medium",
              "low",
              "info"
            ]
          },
          "evidence": {
            "type": "string",
            "description": "reproducible; names what was checked, what was found, and how to confirm"
          },
          "suggested_action": {
            "type": "object",
            "required": [
              "summary",
              "priority"
            ],
            "properties": {
              "summary": {
                "type": "string"
              },
              "priority": {
                "enum": [
                  "critical",
                  "high",
                  "medium",
                  "low"
                ]
              },
              "effort": {
                "enum": [
                  "low",
                  "medium",
                  "high"
                ]
              },
              "how": {
                "type": "array",
                "items": {
                  "type": "string"
                }
              },
              "verify": {
                "type": "string",
                "description": "how to confirm the fix worked"
              },
              "site_specific": {
                "type": "array",
                "items": {
                  "type": "string"
                },
                "description": "steps written by the agent review for this site, admitted only when grounded_on.quote is on grounded_on.url"
              },
              "grounded_on": {
                "type": "object",
                "required": [
                  "url",
                  "quote"
                ],
                "properties": {
                  "url": {
                    "type": "string"
                  },
                  "quote": {
                    "type": "string"
                  }
                }
              }
            }
          },
          "check_id": {
            "type": "string"
          },
          "source": {
            "enum": [
              "scripted",
              "agent_review"
            ],
            "description": "scripted = a tested check with a published severity; agent_review = a reviewer's claim whose evidence was checked against the crawl (always heuristic, at most low)"
          },
          "hurts": {
            "enum": [
              "ai_discoverability",
              "user_retention",
              "both"
            ],
            "description": "plain-language tag: does this cost AI assistants finding/citing the site, visitors staying, or both"
          },
          "gate": {
            "enum": [
              "access",
              "extractability",
              "interpretability",
              "freshness",
              "engagement",
              "review",
              "unknown"
            ]
          },
          "mechanism": {
            "type": "string"
          },
          "status": {
            "enum": [
              "active",
              "latent",
              "confirm_intent"
            ],
            "description": "active = live defect; latent = real but unobservable behind an access blocker; confirm_intent = looks like deliberate configuration, asked rather than asserted"
          },
          "confidence": {
            "enum": [
              "deterministic",
              "heuristic"
            ]
          },
          "measurement_basis": {
            "enum": [
              "static_fact",
              "static_heuristic"
            ]
          },
          "blast_radius": {
            "enum": [
              "site_wide",
              "template",
              "single_page"
            ]
          },
          "severity_rationale": {
            "type": "string",
            "description": "the arithmetic behind the severity, auditable"
          },
          "affected_urls": {
            "type": "array",
            "items": {
              "type": "string"
            }
          },
          "affected_url_count": {
            "type": "integer"
          },
          "blocked_by": {
            "type": "object",
            "properties": {
              "finding_check": {
                "type": "string"
              },
              "agents_affected": {
                "type": "array",
                "items": {
                  "type": "string"
                }
              },
              "note": {
                "type": "string"
              }
            }
          },
          "detail": {
            "type": "object"
          },
          "intent_signals": {
            "type": "array",
            "items": {
              "type": "string"
            },
            "description": "why this reads as a deliberate choice rather than a defect"
          }
        }
      }
    },
    "site_profile": {
      "type": "object"
    },
    "coverage": {
      "type": "object"
    },
    "checks_skipped": {
      "type": "array",
      "items": {
        "type": "object",
        "required": [
          "check",
          "reason"
        ],
        "properties": {
          "check": {
            "type": "string"
          },
          "reason": {
            "type": "string"
          },
          "impact": {
            "type": "string"
          }
        }
      }
    },
    "prioritized_actions": {
      "type": "array"
    },
    "proactive_recommendations": {
      "type": "array",
      "description": "Only recommendations the site does not already satisfy; each carries applies_because"
    },
    "already_in_place": {
      "type": "array",
      "description": "Proactive recommendations the site already implements, with the evidence"
    },
    "limits": {
      "type": "array",
      "description": "What the audit did not assess: 'Not assessed: X. Reason: Y. How to check it yourself: Z.'",
      "items": {
        "type": "string"
      }
    },
    "agent_review": {
      "type": "object",
      "description": "Whether an agent review ran, and what happened to its claims",
      "required": [
        "status"
      ],
      "properties": {
        "status": {
          "enum": [
            "not_run",
            "run",
            "failed"
          ]
        },
        "claims_submitted": {
          "type": "integer"
        },
        "verified": {
          "type": "integer",
          "description": "claims whose every evidence assertion held against the crawl"
        },
        "merged": {
          "type": "integer",
          "description": "verified claims added to findings[] after removing duplicates of scripted findings"
        },
        "claim_limit": {
          "type": "integer"
        },
        "rejected": {
          "type": "array",
          "items": {
            "type": "object",
            "required": [
              "title",
              "reason"
            ]
          }
        },
        "error": {
          "type": "string"
        },
        "fixes_submitted": {
          "type": "integer"
        },
        "fixes_verified": {
          "type": "integer",
          "description": "fixes whose quote was found on the named page"
        },
        "fixes_merged": {
          "type": "integer",
          "description": "verified fixes attached to a finding that reports that page"
        },
        "rejected_fixes": {
          "type": "array",
          "items": {
            "type": "object",
            "required": [
              "reason"
            ]
          }
        }
      }
    },
    "notes": {
      "type": "array",
      "items": {
        "type": "string"
      }
    }
  }
}
