{
  "site": "www.bigbasket.com",
  "audited_at": "2026-09-12T17:04:30Z",
  "summary": {
    "total_findings": 12,
    "critical": 0,
    "high": 0,
    "medium": 6,
    "low": 6,
    "active_findings": 12,
    "latent_findings": 0,
    "confirm_intent_findings": 0,
    "info": 0,
    "active_by_severity": {
      "critical": 0,
      "high": 0,
      "medium": 6,
      "low": 6
    },
    "by_hurts": {
      "ai_discoverability": 3,
      "user_retention": 7,
      "both": 2
    },
    "run_status": "partial",
    "headline": "12 finding(s); most severe: Brand identity is not anchored to any external profile"
  },
  "findings": [
    {
      "id": "F-001",
      "title": "Brand identity is not anchored to any external profile",
      "severity": "medium",
      "evidence": "None of the 11 crawled page(s) declares Organization, LocalBusiness or similar structured data with sameAs links. Without sameAs, an assistant has nothing distinguishing this brand from others sharing the name, which is the standard cause of mistaken identity.",
      "suggested_action": {
        "summary": "Publish Organization JSON-LD with sameAs links to authoritative profiles.",
        "priority": "medium",
        "effort": "low",
        "how": [
          "Add Organization markup with \"sameAs\": [Wikidata, LinkedIn, Crunchbase, and your primary social profiles].",
          "Use the identical legal/brand name across title tags, markup and body copy."
        ],
        "verify": "Rich Results Test shows Organization with a populated sameAs array."
      },
      "check_id": "C3_entity_unanchored",
      "source": "scripted",
      "hurts": "ai_discoverability",
      "gate": "interpretability",
      "mechanism": "D",
      "status": "active",
      "confidence": "deterministic",
      "measurement_basis": "static_fact",
      "blast_radius": "site_wide",
      "severity_rationale": "base=medium (interpretability/C3_entity_unanchored); blast=site_wide x1.0 => medium",
      "affected_urls": [
        "https://www.bigbasket.com/"
      ],
      "affected_url_count": 1
    },
    {
      "id": "F-002",
      "title": "No viewport meta tag on 4 page(s)",
      "severity": "medium",
      "evidence": "4/11 crawled page(s) have no <meta name=\"viewport\"> at all. Examples: ['https://www.bigbasket.com/contact', 'https://www.bigbasket.com/about-us', 'https://www.bigbasket.com/payment-methods']. Without it, mobile browsers lay the page out at a desktop width (about 980px) and shrink it to fit, so text is unreadable until the visitor pinch-zooms.",
      "suggested_action": {
        "summary": "Add a viewport meta tag to every page template.",
        "priority": "medium",
        "effort": "low",
        "how": [
          "Add <meta name=\"viewport\" content=\"width=device-width, initial-scale=1\"> inside <head> in the base template.",
          "Do not add user-scalable=no or a maximum-scale below 2 while you are there (see E7)."
        ],
        "verify": "On a phone, the page text is readable without zooming and no horizontal scrollbar appears."
      },
      "check_id": "E11_no_viewport",
      "source": "scripted",
      "hurts": "user_retention",
      "gate": "engagement",
      "mechanism": "on-site",
      "status": "active",
      "confidence": "deterministic",
      "measurement_basis": "static_fact",
      "blast_radius": "template",
      "severity_rationale": "base=medium (engagement/E11_no_viewport); blast=template x0.8 => medium",
      "affected_urls": [
        "https://www.bigbasket.com/about-us",
        "https://www.bigbasket.com/contact",
        "https://www.bigbasket.com/customer-speak",
        "https://www.bigbasket.com/payment-methods"
      ],
      "affected_url_count": 4
    },
    {
      "id": "F-003",
      "title": "Form field(s) without a label in a template used on 6 page(s)",
      "severity": "medium",
      "evidence": "Form action='/ps/' (fields: q) appears on 6 page(s); 1 of 1 field(s) have no associated label: q (unlabelled). Placeholder text disappears once typing starts, so a required field with nothing else naming it is easy to get wrong.",
      "suggested_action": {
        "summary": "Label every form field programmatically.",
        "priority": "medium",
        "effort": "low",
        "how": [
          "Associate every input with a <label for=\"id\">, or an aria-label where there is no room for visible text.",
          "Keep the placeholder as an example value, not as the only name.",
          "Add autocomplete tokens and the right type/inputmode so mobile keyboards match."
        ],
        "verify": "Every input, select and textarea resolves to a non-empty accessible name without relying on its placeholder."
      },
      "check_id": "E1_unlabelled_input",
      "source": "scripted",
      "hurts": "user_retention",
      "gate": "engagement",
      "mechanism": "on-site",
      "status": "active",
      "confidence": "heuristic",
      "measurement_basis": "static_heuristic",
      "blast_radius": "template",
      "severity_rationale": "base=medium (engagement/E1_unlabelled_input); blast=template x0.8 => medium",
      "affected_urls": [
        "https://www.bigbasket.com/about-us",
        "https://www.bigbasket.com/contact",
        "https://www.bigbasket.com/customer-speak",
        "https://www.bigbasket.com/payment-methods",
        "https://www.bigbasket.com/privacy-policy",
        "https://www.bigbasket.com/terms-and-conditions"
      ],
      "affected_url_count": 6
    },
    {
      "id": "F-004",
      "title": "Interactive controls without an accessible name on 9 page(s)",
      "severity": "medium",
      "evidence": "https://www.bigbasket.com/: 8/62 controls expose no text, aria-label, aria-labelledby, title, SVG title or image alt; https://www.bigbasket.com/auth/signup: 3/46 controls expose no text, aria-label, aria-labelledby, title, SVG title or image alt; https://www.bigbasket.com/auth/login: 8/62 controls expose no text, aria-label, aria-labelledby, title, SVG title or image alt; https://www.bigbasket.com/contact: 22/1288 controls expose no text, aria-label, aria-labelledby, title, SVG title or image alt. Controls whose name is bound by a JS framework (v-, x-, ng-, :, @, [) were assumed named at runtime and not counted.",
      "suggested_action": {
        "summary": "Give every control a name a machine can read.",
        "priority": "medium",
        "effort": "low",
        "how": [
          "Add visible text, or aria-label where the control is icon-only.",
          "An unnamed control is unusable with a screen reader and invisible to any agent trying to understand what actions the page offers."
        ],
        "verify": "Every button/link resolves to a non-empty accessible name."
      },
      "check_id": "E3_unnamed_controls",
      "source": "scripted",
      "hurts": "user_retention",
      "gate": "engagement",
      "mechanism": "on-site",
      "status": "active",
      "confidence": "heuristic",
      "measurement_basis": "static_heuristic",
      "blast_radius": "template",
      "severity_rationale": "base=medium (engagement/E3_unnamed_controls); blast=template x0.8 => medium",
      "affected_urls": [
        "https://www.bigbasket.com/",
        "https://www.bigbasket.com/about-us",
        "https://www.bigbasket.com/auth/login",
        "https://www.bigbasket.com/auth/signup",
        "https://www.bigbasket.com/contact",
        "https://www.bigbasket.com/customer-speak",
        "https://www.bigbasket.com/payment-methods",
        "https://www.bigbasket.com/privacy-policy",
        "https://www.bigbasket.com/terms-and-conditions"
      ],
      "affected_url_count": 9
    },
    {
      "id": "F-005",
      "title": "Images missing alt attributes on 3 page(s)",
      "severity": "medium",
      "evidence": "https://www.bigbasket.com/contact: 4/11 images have no alt attribute; https://www.bigbasket.com/customer-speak: 17/24 images have no alt attribute; https://www.bigbasket.com/privacy-policy: 3/10 images have no alt attribute. Tracking pixels, images inside <noscript> and images marked presentational or aria-hidden are not counted.",
      "suggested_action": {
        "summary": "Add alt text to content images; use alt=\"\" for decorative ones.",
        "priority": "medium",
        "effort": "low",
        "how": [
          "Describe what the image conveys, not that it is an image.",
          "If a price, specification table or contact detail exists only inside an image, restate it as text: retrieval agents do not read images.",
          "Decorative images should carry an explicit empty alt=\"\" so assistive tech skips them."
        ],
        "verify": "No content <img> lacks an alt attribute entirely."
      },
      "check_id": "E4_images_missing_alt",
      "source": "scripted",
      "hurts": "both",
      "gate": "engagement",
      "mechanism": "C",
      "status": "active",
      "confidence": "heuristic",
      "measurement_basis": "static_heuristic",
      "blast_radius": "template",
      "severity_rationale": "base=medium (engagement/E4_images_missing_alt); blast=template x0.8 => medium",
      "affected_urls": [
        "https://www.bigbasket.com/contact",
        "https://www.bigbasket.com/customer-speak",
        "https://www.bigbasket.com/privacy-policy"
      ],
      "affected_url_count": 3
    },
    {
      "id": "F-006",
      "title": "Pinch-zoom suppressed on 2 page(s)",
      "severity": "medium",
      "evidence": "2/11 crawled page(s) restrict zoom in the viewport meta tag, failing WCAG 1.4.4 (Resize Text). Examples: https://www.bigbasket.com/auth/signup sets user-scalable=no; https://www.bigbasket.com/faq sets maximum-scale=1.0 (below the 200% WCAG 1.4.4 requires). iOS Safari has ignored these directives since iOS 10, so the impact falls on Android Chrome and other browsers that still honour them.",
      "suggested_action": {
        "summary": "Allow users to zoom.",